{
  "$schema": "https://json-schema.org/draft-04/schema",
  "description": "An array containing one prediction result for each submitted BMP record. Retrospective and mix-ratio fields are included only when complete post-specimen results are supplied.",
  "type": "array",
  "items": {
    "type": "object",
    "additionalProperties": false,
    "properties": {
      "sodium": { "type": "number" }, "chloride": { "type": "number" }, "potassium_plas": { "type": "number" }, "co2_totl": { "type": "number" }, "bun": { "type": "number" }, "creatinine": { "type": "number" }, "calcium": { "type": "number" }, "glucose": { "type": "number" },
      "sodium_prior": { "type": "number" }, "chloride_prior": { "type": "number" }, "potassium_plas_prior": { "type": "number" }, "co2_totl_prior": { "type": "number" }, "bun_prior": { "type": "number" }, "creatinine_prior": { "type": "number" }, "calcium_prior": { "type": "number" }, "glucose_prior": { "type": "number" },
      "sodium_post": { "type": "number" }, "chloride_post": { "type": "number" }, "potassium_plas_post": { "type": "number" }, "co2_totl_post": { "type": "number" }, "bun_post": { "type": "number" }, "creatinine_post": { "type": "number" }, "calcium_post": { "type": "number" }, "glucose_post": { "type": "number" },
      "prob_NS_Realtime": { "type": "number" }, "pred_NS_Realtime": { "type": ["string", "null"] },
      "prob_LR_Realtime": { "type": "number" }, "pred_LR_Realtime": { "type": ["string", "null"] },
      "prob_D5NS_Realtime": { "type": "number" }, "pred_D5NS_Realtime": { "type": ["string", "null"] },
      "prob_D5LR_Realtime": { "type": "number" }, "pred_D5LR_Realtime": { "type": ["string", "null"] },
      "prob_D5W_Realtime": { "type": "number" }, "pred_D5W_Realtime": { "type": ["string", "null"] },
      "prob_D5halfNSwK_Realtime": { "type": "number" }, "pred_D5halfNSwK_Realtime": { "type": ["string", "null"] },
      "prob_D5halfNS_Realtime": { "type": "number" }, "pred_D5halfNS_Realtime": { "type": ["string", "null"] },
      "prob_halfNS_Realtime": { "type": "number" }, "pred_halfNS_Realtime": { "type": ["string", "null"] },
      "prob_Water_Realtime": { "type": "number" }, "pred_Water_Realtime": { "type": ["string", "null"] },
      "prob_NS_Retrospective": { "type": "number" }, "pred_NS_Retrospective": { "type": ["string", "null"] },
      "prob_LR_Retrospective": { "type": "number" }, "pred_LR_Retrospective": { "type": ["string", "null"] },
      "prob_D5NS_Retrospective": { "type": "number" }, "pred_D5NS_Retrospective": { "type": ["string", "null"] },
      "prob_D5LR_Retrospective": { "type": "number" }, "pred_D5LR_Retrospective": { "type": ["string", "null"] },
      "prob_D5W_Retrospective": { "type": "number" }, "pred_D5W_Retrospective": { "type": ["string", "null"] },
      "prob_D5halfNSwK_Retrospective": { "type": "number" }, "pred_D5halfNSwK_Retrospective": { "type": ["string", "null"] },
      "prob_D5halfNS_Retrospective": { "type": "number" }, "pred_D5halfNS_Retrospective": { "type": ["string", "null"] },
      "prob_halfNS_Retrospective": { "type": "number" }, "pred_halfNS_Retrospective": { "type": ["string", "null"] },
      "prob_Water_Retrospective": { "type": "number" }, "pred_Water_Retrospective": { "type": ["string", "null"] },
      "mix_ratio_NS": { "type": "number" }, "mix_ratio_LR": { "type": "number" }, "mix_ratio_D5NS": { "type": "number" }, "mix_ratio_D5LR": { "type": "number" }, "mix_ratio_D5W": { "type": "number" }, "mix_ratio_D5halfNSwK": { "type": "number" }, "mix_ratio_D5halfNS": { "type": "number" }, "mix_ratio_halfNS": { "type": "number" }, "mix_ratio_Water": { "type": "number" },
      "any_realtime_pred": { "type": "boolean" }, "any_realtime_pred_with_LR": { "type": "boolean" }, "max_realtime_prob": { "type": "number" }, "max_prob_fluid_realtime": { "type": "string" }, "max_realtime_prob_with_LR": { "type": "number" },
      "any_retrospective_pred": { "type": "boolean" }, "any_retrospective_pred_with_LR": { "type": "boolean" }, "max_retrospective_prob": { "type": "number" }, "max_prob_fluid_retrospective": { "type": "string" }, "max_retrospective_prob_with_LR": { "type": "number" }, "max_mix_ratio": { "type": "number" }, "max_mix_ratio_with_LR": { "type": "number" }
    },
    "required": [
      "sodium", "chloride", "potassium_plas", "co2_totl", "bun", "creatinine", "calcium", "glucose",
      "sodium_prior", "chloride_prior", "potassium_plas_prior", "co2_totl_prior", "bun_prior", "creatinine_prior", "calcium_prior", "glucose_prior",
      "prob_NS_Realtime", "pred_NS_Realtime", "prob_LR_Realtime", "pred_LR_Realtime", "prob_D5NS_Realtime", "pred_D5NS_Realtime", "prob_D5LR_Realtime", "pred_D5LR_Realtime", "prob_D5W_Realtime", "pred_D5W_Realtime", "prob_D5halfNSwK_Realtime", "pred_D5halfNSwK_Realtime", "prob_D5halfNS_Realtime", "pred_D5halfNS_Realtime", "prob_halfNS_Realtime", "pred_halfNS_Realtime", "prob_Water_Realtime", "pred_Water_Realtime",
      "any_realtime_pred", "any_realtime_pred_with_LR", "max_realtime_prob", "max_prob_fluid_realtime", "max_realtime_prob_with_LR"
    ]
  }
}
