{
  "sodium": 148.0,
  "chloride": 144.0,
  "potassium_plas": 2.7,
  "co2_totl": 16.0,
  "bun": 40.0,
  "creatinine": 2.42,
  "calcium": 6.9,
  "glucose": 181.0,
  "sodium_prior": 132.0,
  "chloride_prior": 83.0,
  "potassium_plas_prior": 4.5,
  "co2_totl_prior": 24.0,
  "bun_prior": 49.0,
  "creatinine_prior": 3.62,
  "calcium_prior": 10.3,
  "glucose_prior": 135.0,
  "sodium_post": 135.0,
  "chloride_post": 94.0,
  "potassium_plas_post": 3.4,
  "co2_totl_post": 28.0,
  "bun_post": 32.0,
  "creatinine_post": 1.75,
  "calcium_post": 9.0,
  "glucose_post": 133.0,
  "prob_NS_Realtime": 1.0,
  "prob_NS_Retrospective": 0.999,
  "prob_LR_Realtime": 0.0,
  "prob_LR_Retrospective": 0.001,
  "prob_D5NS_Realtime": 0.0,
  "prob_D5NS_Retrospective": 0.0,
  "prob_D5LR_Realtime": 0.0,
  "prob_D5LR_Retrospective": 0.0,
  "prob_D5W_Realtime": 0.0,
  "prob_D5W_Retrospective": 0.0,
  "prob_D5halfNSwK_Realtime": 0.0,
  "prob_D5halfNSwK_Retrospective": 0.0,
  "prob_D5halfNS_Realtime": 0.0,
  "prob_D5halfNS_Retrospective": 0.0,
  "prob_halfNS_Realtime": 0.004,
  "prob_halfNS_Retrospective": 0.012,
  "prob_Water_Realtime": 0.0,
  "prob_Water_Retrospective": 0.0,
  "pred_NS_Realtime": "Contaminated",
  "pred_NS_Retrospective": "Contaminated",
  "pred_LR_Realtime": "Real",
  "pred_LR_Retrospective": "Real",
  "pred_D5NS_Realtime": "Real",
  "pred_D5NS_Retrospective": "Real",
  "pred_D5LR_Realtime": "Real",
  "pred_D5LR_Retrospective": "Real",
  "pred_D5W_Realtime": "Real",
  "pred_D5W_Retrospective": "Real",
  "pred_D5halfNSwK_Realtime": "Real",
  "pred_D5halfNSwK_Retrospective": "Real",
  "pred_D5halfNS_Realtime": "Real",
  "pred_D5halfNS_Retrospective": "Real",
  "pred_halfNS_Realtime": "Real",
  "pred_halfNS_Retrospective": "Real",
  "pred_Water_Realtime": "Real",
  "pred_Water_Retrospective": "Real",
  "mix_ratio_NS": 0.3,
  "mix_ratio_LR": 0.087,
  "mix_ratio_D5NS": 0.066,
  "mix_ratio_D5LR": 0.06,
  "mix_ratio_D5W": 0.043,
  "mix_ratio_D5halfNSwK": 0.052,
  "mix_ratio_D5halfNS": 0.063,
  "mix_ratio_halfNS": 0.182,
  "mix_ratio_Water": 0.17,
  "any_realtime_pred": true,
  "any_realtime_pred_with_LR": true,
  "any_retrospective_pred": true,
  "any_retrospective_pred_with_LR": true,
  "max_realtime_prob": 1.0,
  "max_prob_fluid_realtime": "NS",
  "max_realtime_prob_with_LR": 1.0,
  "max_retrospective_prob": 0.999,
  "max_prob_fluid_retrospective": "NS",
  "max_retrospective_prob_with_LR": 0.999,
  "max_mix_ratio": 0.3,
  "max_mix_ratio_with_LR": 0.3
}
